No.     Time           Source                Destination           Protocol Length Info
   8435 23.594534827   192.168.1.35          151.80.185.213        TCP      76     39302 → 4000 [SYN] Seq=0 Win=29200 Len=0 MSS=1460 SACK_PERM=1 TSval=1060327483 TSecr=0 WS=128

Frame 8435: 76 bytes on wire (608 bits), 76 bytes captured (608 bits) on interface 0
Linux cooked capture
Internet Protocol Version 4, Src: 192.168.1.35, Dst: 151.80.185.213
Transmission Control Protocol, Src Port: 39302, Dst Port: 4000, Seq: 0, Len: 0

No.     Time           Source                Destination           Protocol Length Info
   8436 23.616030229   151.80.185.213        192.168.1.35          TCP      76     4000 → 39302 [SYN, ACK] Seq=0 Ack=1 Win=8192 Len=0 MSS=1460 WS=256 SACK_PERM=1 TSval=8599727 TSecr=1060327483

Frame 8436: 76 bytes on wire (608 bits), 76 bytes captured (608 bits) on interface 0
Linux cooked capture
Internet Protocol Version 4, Src: 151.80.185.213, Dst: 192.168.1.35
Transmission Control Protocol, Src Port: 4000, Dst Port: 39302, Seq: 0, Ack: 1, Len: 0

No.     Time           Source                Destination           Protocol Length Info
   8437 23.616078066   192.168.1.35          151.80.185.213        TCP      68     39302 → 4000 [ACK] Seq=1 Ack=1 Win=29312 Len=0 TSval=1060327504 TSecr=8599727

Frame 8437: 68 bytes on wire (544 bits), 68 bytes captured (544 bits) on interface 0
Linux cooked capture
Internet Protocol Version 4, Src: 192.168.1.35, Dst: 151.80.185.213
Transmission Control Protocol, Src Port: 39302, Dst Port: 4000, Seq: 1, Ack: 1, Len: 0

No.     Time           Source                Destination           Protocol Length Info
   8439 23.641940529   151.80.185.213        192.168.1.35          TCP      70     4000 → 39302 [PSH, ACK] Seq=1 Ack=1 Win=131584 Len=2 TSval=8599730 TSecr=1060327504

Frame 8439: 70 bytes on wire (560 bits), 70 bytes captured (560 bits) on interface 0
Linux cooked capture
Internet Protocol Version 4, Src: 151.80.185.213, Dst: 192.168.1.35
Transmission Control Protocol, Src Port: 4000, Dst Port: 39302, Seq: 1, Ack: 1, Len: 2
Data (2 bytes)

0000  af 01                                             ..

No.     Time           Source                Destination           Protocol Length Info
   8440 23.641965409   192.168.1.35          151.80.185.213        TCP      68     39302 → 4000 [ACK] Seq=1 Ack=3 Win=29312 Len=0 TSval=1060327530 TSecr=8599730

Frame 8440: 68 bytes on wire (544 bits), 68 bytes captured (544 bits) on interface 0
Linux cooked capture
Internet Protocol Version 4, Src: 192.168.1.35, Dst: 151.80.185.213
Transmission Control Protocol, Src Port: 39302, Dst Port: 4000, Seq: 1, Ack: 3, Len: 0

No.     Time           Source                Destination           Protocol Length Info
   8441 23.645277340   192.168.1.35          151.80.185.213        TCP      105    39302 → 4000 [PSH, ACK] Seq=1 Ack=3 Win=29312 Len=37 TSval=1060327533 TSecr=8599730

Frame 8441: 105 bytes on wire (840 bits), 105 bytes captured (840 bits) on interface 0
Linux cooked capture
Internet Protocol Version 4, Src: 192.168.1.35, Dst: 151.80.185.213
Transmission Control Protocol, Src Port: 39302, Dst Port: 4000, Seq: 1, Ack: 3, Len: 37
Data (37 bytes)

0000  68 44 21 55 5b 40 00 01 0d 00 00 00 50 cc 5d ed   hD!U[@......P.].
0010  b6 19 a5 91 00 63 68 65 61 70 00 00 6a 39 af 6f   .....cheap..j9.o
0020  01 00 00 00 00                                    .....

No.     Time           Source                Destination           Protocol Length Info
   8444 23.738417961   151.80.185.213        192.168.1.35          TCP      75     4000 → 39302 [PSH, ACK] Seq=3 Ack=38 Win=131584 Len=7 TSval=8599739 TSecr=1060327533

Frame 8444: 75 bytes on wire (600 bits), 75 bytes captured (600 bits) on interface 0
Linux cooked capture
Internet Protocol Version 4, Src: 151.80.185.213, Dst: 192.168.1.35
Transmission Control Protocol, Src Port: 4000, Dst Port: 39302, Seq: 3, Ack: 38, Len: 7
Data (7 bytes)

0000  07 75 d0 1d 9a 5f 5c                              .u..._\

No.     Time           Source                Destination           Protocol Length Info
   8445 23.738463845   192.168.1.35          151.80.185.213        TCP      81     39302 → 4000 [PSH, ACK] Seq=38 Ack=10 Win=29312 Len=13 TSval=1060327627 TSecr=8599739

Frame 8445: 81 bytes on wire (648 bits), 81 bytes captured (648 bits) on interface 0
Linux cooked capture
Internet Protocol Version 4, Src: 192.168.1.35, Dst: 151.80.185.213
Transmission Control Protocol, Src Port: 39302, Dst Port: 4000, Seq: 38, Ack: 10, Len: 13
Data (13 bytes)

0000  6d 94 26 03 00 00 00 00 00 00 00 00 00            m.&..........

No.     Time           Source                Destination           Protocol Length Info
   8448 23.816158320   151.80.185.213        192.168.1.35          TCP      75     4000 → 39302 [PSH, ACK] Seq=10 Ack=51 Win=131584 Len=7 TSval=8599747 TSecr=1060327627

Frame 8448: 75 bytes on wire (600 bits), 75 bytes captured (600 bits) on interface 0
Linux cooked capture
Internet Protocol Version 4, Src: 151.80.185.213, Dst: 192.168.1.35
Transmission Control Protocol, Src Port: 4000, Dst Port: 39302, Seq: 10, Ack: 51, Len: 7
Data (7 bytes)

0000  07 1f 7f ff ff ff c0                              .......

No.     Time           Source                Destination           Protocol Length Info
   8449 23.816197935   192.168.1.35          151.80.185.213        TCP      69     39302 → 4000 [PSH, ACK] Seq=51 Ack=17 Win=29312 Len=1 TSval=1060327704 TSecr=8599747

Frame 8449: 69 bytes on wire (552 bits), 69 bytes captured (552 bits) on interface 0
Linux cooked capture
Internet Protocol Version 4, Src: 192.168.1.35, Dst: 151.80.185.213
Transmission Control Protocol, Src Port: 39302, Dst Port: 4000, Seq: 51, Ack: 17, Len: 1
Data (1 byte)

0000  6b                                                k

No.     Time           Source                Destination           Protocol Length Info
   8614 23.947043837   151.80.185.213        192.168.1.35          TCP      337    4000 → 39302 [PSH, ACK] Seq=17 Ack=52 Win=131584 Len=269 TSval=8599752 TSecr=1060327704

Frame 8614: 337 bytes on wire (2696 bits), 337 bytes captured (2696 bits) on interface 0
Linux cooked capture
Internet Protocol Version 4, Src: 151.80.185.213, Dst: 192.168.1.35
Transmission Control Protocol, Src Port: 4000, Dst Port: 39302, Seq: 17, Ack: 52, Len: 269
Data (269 bytes)

0000  f1 0d 17 5f b9 65 50 ca 32 0d 5f ff c1 0d f9 92   ..._.eP.2._.....
0010  b1 74 33 36 74 37 df 81 16 9f ee bd de e1 2e e1   .t36t7..........
0020  32 e1 36 e1 3a e7 ee 10 9d c3 bb 92 6e 1e 5a 10   2.6.:.......n.Z.
0030  2e 00 2e 4c b4 23 52 08 f7 12 2d 09 d7 14 2d 07   ...L.#R...-...-.
0040  32 2d f8 4e a6 0e 61 eb bf 79 f3 51 d1 2a a0 06   2-.N..a..y.Q.*..
0050  14 91 14 c3 09 a1 f6 ce b1 d8 16 86 41 a4 a6 18   ............A...
0060  4d 0f 82 35 fa 22 2c d0 0a 22 40 53 06 d8 75 7e   M..5.",.."@S..u~
0070  e2 45 b6 db 6c 3a bf 88 f6 db 6d b1 85 ef 77 de   .E..l:....m...w.
0080  fe ee ef 77 dd fb bd dd dd c9 48 7e f7 34 32 a4   ...w......H~.42.
0090  5b e4 73 47 bd 32 d1 74 d1 82 e0 f0 6a c1 a1 24   [.sG.2.t....j..$
00a0  d1 fe e6 9e 60 68 e9 9e f7 34 76 5c b8 ff ff 48   ....`h...4v\...H
00b0  b5 1d 1f 47 d7 5b ff e1 f7 5b d6 fd 6f 3b ad e4   ...G.[...[..o;..
00c0  04 80 ad ad fe b7 e4 04 80 fa da da df ff eb 7f   ................
00d0  fa df ff 31 bf 18 9f 9c c6 03 97 1d 4e 57 23 a8   ...1........NW#.
00e0  3e 1f 39 d2 29 14 bc e8 c2 3e bc e8 c6 1f 2f 39   >.9.)....>..../9
00f0  32 18 0e 8c ce 41 09 a4 0a a0 23 9a 3f 34 ad 8c   2....A....#.?4..
0100  b0 c0 29 07 a0 b1 0a e0 62 1d 86 94 40            ..).....b...@

No.     Time           Source                Destination           Protocol Length Info
   8615 23.948046734   151.80.185.213        192.168.1.35          TCP      504    4000 → 39302 [PSH, ACK] Seq=286 Ack=52 Win=131584 Len=436 TSval=8599752 TSecr=1060327704

Frame 8615: 504 bytes on wire (4032 bits), 504 bytes captured (4032 bits) on interface 0
Linux cooked capture
Internet Protocol Version 4, Src: 151.80.185.213, Dst: 192.168.1.35
Transmission Control Protocol, Src Port: 4000, Dst Port: 39302, Seq: 286, Ack: 52, Len: 436
Data (436 bytes)

0000  f1 b4 02 a8 03 73 45 f9 a5 6c 65 99 08 a1 20 d8   .....sE..le... .
0010  fa e2 0b 10 18 80 7c 09 83 b8 15 40 1b 9a 1f e6   ......|....@....
0020  95 b1 96 43 08 81 20 d8 fa e2 0a 78 0c 40 3e 04   ...C.. ....x.@>.
0030  c1 dc 0a a0 0d cd 10 73 4a d8 cb 0b 62 20 48 36   .......sJ...b H6
0040  3e b8 82 9e 36 85 58 0d 6c 0a a0 38 34 63 9a 56   >...6.X.l..84c.V
0050  c6 59 a0 29 2b 17 91 2e 09 c8 42 1c 50 02 a8 14   .Y.)+.....B.P...
0060  1a 21 e6 95 b1 96 0f c4 40 90 6c 7d 71 04 03 ab   .!......@.l}q...
0070  01 85 a0 6a 62 d0 2b 6c 0a a0 0d cd 11 73 4a d8   ...jb.+l.....sJ.
0080  cb 48 22 84 83 63 eb 88 2c 40 62 01 f0 26 0e e0   .H"..c..,@b..&..
0090  55 02 83 44 7c d2 b6 32 c2 c8 88 12 0d 8f 8f 21   U..D|..2.......!
00a0  f9 74 12 88 25 a2 80 41 1f c1 f8 ee 05 48 cd 1a   .t..%..A.....H..
00b0  18 73 44 04 02 31 95 1d 6a 11 70 fa e0 54 8c d1   .sD..1..j.p..T..
00c0  a2 4e 68 80 80 8c a8 d0 9d a9 07 48 57 02 a8 03   .Nh........HW...
00d0  73 43 1e 69 5b 19 60 f4 44 09 06 c7 c7 90 fd 88   sC.i[.`.D.......
00e0  0c 40 3e 04 c1 dc 0a a0 50 68 65 cd 2b 63 2c 89   .@>.....Phe.+c,.
00f0  11 02 41 b1 f1 e4 3f 01 a0 94 41 2d 30 10 47 f0   ..A...?...A-0.G.
0100  7e 3b 81 54 01 b9 a2 5e 69 5b 19 68 c4 50 90 6c   ~;.T...^i[.h.P.l
0110  7c 79 0f d8 80 c4 03 e0 4c 1d c0 aa 00 dc d0 8d   |y......L.......
0120  cd 2b 63 2c 1d 88 81 20 d8 f8 f2 1f a5 80 c4 00   .+c,... ........
0130  f4 26 0e e0 55 01 d1 a1 9f 34 ad 8c b4 22 28 48   .&..U....4..."(H
0140  36 3e 3c 87 e9 c5 30 18 15 07 a4 04 00 1f 0d 48   6><...0........H
0150  80 aa 00 dc d0 d3 9a 56 c6 58 56 11 02 41 b1 f1   .......V.XV..A..
0160  e4 3f 4f 01 88 01 e8 4c 1d c0 aa 06 8d 0d 79 a2   .?O....L......y.
0170  02 02 32 c8 c3 d2 11 70 fa e0 55 03 46 89 b9 a2   ..2....p..U.F...
0180  02 02 32 c2 e8 f2 84 5c 3e b8 05 88 f6 db 6d b0   ..2....\>.....m.
0190  0a e4 cb 6d b6 d8 75 7e e2 45 b6 db 6c 3a bf 88   ...m..u~.E..l:..
01a0  f6 db 6d b3 98 c0 72 e3 a9 ca e4 75 07 c3 e7 3a   ..m...r....u...:
01b0  45 22 97 80                                       E"..

No.     Time           Source                Destination           Protocol Length Info
   8616 23.948057406   192.168.1.35          151.80.185.213        TCP      68     39302 → 4000 [ACK] Seq=52 Ack=722 Win=31360 Len=0 TSval=1060327836 TSecr=8599752

Frame 8616: 68 bytes on wire (544 bits), 68 bytes captured (544 bits) on interface 0
Linux cooked capture
Internet Protocol Version 4, Src: 192.168.1.35, Dst: 151.80.185.213
Transmission Control Protocol, Src Port: 39302, Dst Port: 4000, Seq: 52, Ack: 722, Len: 0

No.     Time           Source                Destination           Protocol Length Info
   8617 23.948074182   151.80.185.213        192.168.1.35          TCP      391    4000 → 39302 [PSH, ACK] Seq=722 Ack=52 Win=131584 Len=323 TSval=8599752 TSecr=1060327704

Frame 8617: 391 bytes on wire (3128 bits), 391 bytes captured (3128 bits) on interface 0
Linux cooked capture
Internet Protocol Version 4, Src: 151.80.185.213, Dst: 192.168.1.35
Transmission Control Protocol, Src Port: 4000, Dst Port: 39302, Seq: 722, Ack: 52, Len: 323
Data (323 bytes)

0000  f1 43 3a 30 8f af 3a 31 87 cb ce 4c 86 03 a3 33   .C:0..:1...L...3
0010  90 42 69 2e a0 1e 81 d4 07 7f 0d c5 20 1e b8 ea   .Bi......... ...
0020  72 1e a4 39 0f 92 1c 88 09 0e 44 24 87 d7 29 8c   r..9......D$..).
0030  c4 e2 a0 b3 1d 91 8d e1 0c 5b 5f fd 11 16 7d 1a   .........[_...}.
0040  01 65 11 14 7e 80 59 44 45 1f 46 80 59 44 45 9f   .e..~.YDE.F.YDE.
0050  a0 16 51 50 50 0b 28 88 a3 e6 88 05 94 44 59 f4   ..QPP.(......DY.
0060  68 05 94 54 08 d0 0b 28 88 b3 e6 88 05 94 54 06   h..T...(......T.
0070  88 05 94 f7 e1 ad 92 5b 4e 3b 78 0e 77 eb f3 c5   .......[N;x.w...
0080  cd 38 de e1 a5 93 66 b3 c5 cc f8 de e1 ad 90 d9   .8....f.........
0090  ac f1 72 37 1b dd b6 48 ed 67 8b a5 e3 7b bb 46   ..r7...H.g...{.F
00a0  cd 67 8b 99 71 bd d0 b4 6c d6 78 b9 8f 1b dc fb   .g..q...l.x.....
00b0  4c b5 9e 2e 93 8d ee 89 a4 cd 67 8b 98 71 bd d1   L.........g..q..
00c0  34 64 d6 78 ba 3e 37 ba 16 8c da cf 17 45 c6 f7   4d.x.>7......E..
00d0  61 a4 cd 67 8b a1 e3 7b a2 68 8c d6 78 bb 1c 6f   a..g...{.h..x..o
00e0  73 ed 1b b5 9e 2e 83 8d ee c3 46 0d 67 8b 9f e3   s.........F.g...
00f0  5b a3 69 43 58 23 41 d1 b8 65 64 42 69 69 19 c1   [.iCX#A..edBii..
0100  0b a0 e6 4a c5 d0 cc d9 d2 c4 1c 32 b2 21 34 b4   ...J.......2.!4.
0110  f1 73 5e 37 43 43 22 3b 4b c8 cb 9a f3 f5 f8 ba   .s^7CC";K.......
0120  bf 72 ca a1 94 64 1a bf f8 6a 64 00 34 37 2f db   .r...d...jd.47/.
0130  6f f3 b5 f9 3f ce d7 e2 9f 9d af cc bc ed 7f f3   o...?...........
0140  b5 fa fe                                          ...

No.     Time           Source                Destination           Protocol Length Info
   8618 23.948077129   151.80.185.213        192.168.1.35          TCP      338    4000 → 39302 [PSH, ACK] Seq=1045 Ack=52 Win=131584 Len=270 TSval=8599752 TSecr=1060327704

Frame 8618: 338 bytes on wire (2704 bits), 338 bytes captured (2704 bits) on interface 0
Linux cooked capture
Internet Protocol Version 4, Src: 151.80.185.213, Dst: 192.168.1.35
Transmission Control Protocol, Src Port: 4000, Dst Port: 39302, Seq: 1045, Ack: 52, Len: 270
Data (270 bytes)

0000  f1 0e 1b 6f d7 e0 86 bf 4a 88 22 02 80 c0 d8 a0   ...o....J.".....
0010  96 bf 30 0d 4c 80 06 b1 be bf 4b 5f 98 06 a6 40   ..0.L.....K_...@
0020  03 58 1e af d1 01 fa fc c5 58 23 0d 26 60 7e fd   .X.......X#.&`~.
0030  a1 50 36 25 42 e8 6e b4 24 a6 18 8f 86 b3 e0 7e   .P6%B.n.$......~
0040  fd 91 54 57 60 80 56 e0 98 4e 06 68 43 4a 20 3f   ..TW`.V..N.hCJ ?
0050  7e c8 ac 2c 01 62 10 3e 60 13 0a 00 cc a8 1a 51   ~..,.b.>`......Q
0060  01 fb f3 15 60 8c 34 99 9c 99 0c 07 31 80 e5 72   ....`.4.....1..r
0070  38 23 3f c3 c7 32 68 9c d2 d3 52 60 70 1e c1 0b   8#?..2h...R`p...
0080  9f e6 4a c5 d0 cc d9 d2 c3 fc c9 a2 73 4b 4f 17   ..J.........sKO.
0090  5f 8d 6e 1b b4 20 b5 9e 2e fc 73 75 da 10 9a c1   _.n.. ....su....
00a0  1a fc 35 57 68 42 69 69 19 c1 0b af cc 95 8b a1   ..5WhBii........
00b0  99 b3 a5 8b f5 da 10 9a 5a 73 18 0e 5c 75 39 5c   ........Zs..\u9\
00c0  8e a0 f8 7c e7 48 a4 52 f3 a3 08 fa f3 a3 18 7c   ...|.H.R.......|
00d0  bc e4 c8 60 3a 33 39 04 26 91 5b 7f e8 05 6d ff   ...`:39.&.[...m.
00e0  8b e1 dd fb 96 55 0c a3 20 d5 ff c6 0b 6d ff 8c   .....U.. ....m..
00f0  af f0 1a fd b6 c5 e5 d0 7c b2 a8 65 19 06 af fe   ........|..e....
0100  50 3d 19 87 01 90 f4 f4 64 2d 0c a3 5f c0         P=......d-.._.

No.     Time           Source                Destination           Protocol Length Info
   8619 23.948080110   192.168.1.35          151.80.185.213        TCP      68     39302 → 4000 [ACK] Seq=52 Ack=1315 Win=33536 Len=0 TSval=1060327836 TSecr=8599752

Frame 8619: 68 bytes on wire (544 bits), 68 bytes captured (544 bits) on interface 0
Linux cooked capture
Internet Protocol Version 4, Src: 192.168.1.35, Dst: 151.80.185.213
Transmission Control Protocol, Src Port: 39302, Dst Port: 4000, Seq: 52, Ack: 1315, Len: 0

No.     Time           Source                Destination           Protocol Length Info
   8621 24.737670592   151.80.185.213        192.168.1.35          TCP      96     4000 → 39302 [PSH, ACK] Seq=1315 Ack=52 Win=131584 Len=28 TSval=8599839 TSecr=1060327836

Frame 8621: 96 bytes on wire (768 bits), 96 bytes captured (768 bits) on interface 0
Linux cooked capture
Internet Protocol Version 4, Src: 151.80.185.213, Dst: 192.168.1.35
Transmission Control Protocol, Src Port: 4000, Dst Port: 39302, Seq: 1315, Ack: 52, Len: 28
Data (28 bytes)

0000  1c 1f 1d 7e a5 07 70 c6 c9 2d a7 a2 16 6c 29 3f   ...~..p..-...l)?
0010  dd 13 42 9b 4f 44 2c d8 10 5d 7e 9a               ..B.OD,..]~.

No.     Time           Source                Destination           Protocol Length Info
   8622 24.780663271   192.168.1.35          151.80.185.213        TCP      68     39302 → 4000 [ACK] Seq=52 Ack=1343 Win=33536 Len=0 TSval=1060328626 TSecr=8599839

Frame 8622: 68 bytes on wire (544 bits), 68 bytes captured (544 bits) on interface 0
Linux cooked capture
Internet Protocol Version 4, Src: 192.168.1.35, Dst: 151.80.185.213
Transmission Control Protocol, Src Port: 39302, Dst Port: 4000, Seq: 52, Ack: 1343, Len: 0

No.     Time           Source                Destination           Protocol Length Info
   8624 25.535441135   151.80.185.213        192.168.1.35          TCP      72     4000 → 39302 [PSH, ACK] Seq=1343 Ack=52 Win=131584 Len=4 TSval=8599919 TSecr=1060328626

Frame 8624: 72 bytes on wire (576 bits), 72 bytes captured (576 bits) on interface 0
Linux cooked capture
Internet Protocol Version 4, Src: 151.80.185.213, Dst: 192.168.1.35
Transmission Control Protocol, Src Port: 4000, Dst Port: 39302, Seq: 1343, Ack: 52, Len: 4
Data (4 bytes)

0000  04 1f 1d 7e                                       ...~

No.     Time           Source                Destination           Protocol Length Info
   8625 25.535464400   192.168.1.35          151.80.185.213        TCP      68     39302 → 4000 [ACK] Seq=52 Ack=1347 Win=33536 Len=0 TSval=1060329424 TSecr=8599919

Frame 8625: 68 bytes on wire (544 bits), 68 bytes captured (544 bits) on interface 0
Linux cooked capture
Internet Protocol Version 4, Src: 192.168.1.35, Dst: 151.80.185.213
Transmission Control Protocol, Src Port: 39302, Dst Port: 4000, Seq: 52, Ack: 1347, Len: 0

No.     Time           Source                Destination           Protocol Length Info
   8627 25.660528815   151.80.185.213        192.168.1.35          TCP      216    4000 → 39302 [PSH, ACK] Seq=1347 Ack=52 Win=131584 Len=148 TSval=8599932 TSecr=1060329424

Frame 8627: 216 bytes on wire (1728 bits), 216 bytes captured (1728 bits) on interface 0
Linux cooked capture
Internet Protocol Version 4, Src: 151.80.185.213, Dst: 192.168.1.35
Transmission Control Protocol, Src Port: 4000, Dst Port: 39302, Seq: 1347, Ack: 52, Len: 148
Data (148 bytes)

0000  94 0f 10 57 f7 8b e3 21 69 62 b1 a1 58 d8 36 8d   ...W...!ib..X.6.
0010  63 20 da 34 8d 63 05 b2 c8 94 2f 8a 62 20 aa 2d   c .4.c..../.b .-
0020  8c 07 62 11 d8 b4 34 9d 96 46 95 8b 06 51 ac b2   ..b...4..F...Q..
0030  ac 64 3d 3b 1a 86 e1 ac 6a 1a 46 c1 94 ed 58 d8   .d=;....j.F...X.
0040  76 32 1e 9e 8d 23 80 ca 5a 0e 1b 2c 88 d0 f1 05   v2...#..Z..,....
0050  7f 78 be 32 16 96 2b 1a 15 8d 83 68 d6 32 0d a3   .x.2..+....h.2..
0060  48 d6 30 45 51 6c 3a 11 09 82 61 d9 50 69 1b 8b   H.0EQl:...a.Pi..
0070  03 22 b1 c4 41 3b 15 06 b1 90 68 2c 8c b0 f1 05   ."..A;....h,....
0080  7f 78 be 32 16 96 2b 1a 15 8d 83 68 d6 32 0d a3   .x.2..+....h.2..
0090  48 d6 30 60                                       H.0`

No.     Time           Source                Destination           Protocol Length Info
   8628 25.660566084   192.168.1.35          151.80.185.213        TCP      68     39302 → 4000 [ACK] Seq=52 Ack=1495 Win=34560 Len=0 TSval=1060329549 TSecr=8599932

Frame 8628: 68 bytes on wire (544 bits), 68 bytes captured (544 bits) on interface 0
Linux cooked capture
Internet Protocol Version 4, Src: 192.168.1.35, Dst: 151.80.185.213
Transmission Control Protocol, Src Port: 39302, Dst Port: 4000, Seq: 52, Ack: 1495, Len: 0

No.     Time           Source                Destination           Protocol Length Info
   8629 25.694664153   192.168.1.35          151.80.185.213        TCP      73     39302 → 4000 [PSH, ACK] Seq=52 Ack=1495 Win=34560 Len=5 TSval=1060329583 TSecr=8599932

Frame 8629: 73 bytes on wire (584 bits), 73 bytes captured (584 bits) on interface 0
Linux cooked capture
Internet Protocol Version 4, Src: 192.168.1.35, Dst: 151.80.185.213
Transmission Control Protocol, Src Port: 39302, Dst Port: 4000, Seq: 52, Ack: 1495, Len: 5
Data (5 bytes)

0000  03 f4 13 33 14                                    ...3.

No.     Time           Source                Destination           Protocol Length Info
   8630 25.922959796   151.80.185.213        192.168.1.35          TCP      68     4000 → 39302 [ACK] Seq=1495 Ack=57 Win=131584 Len=0 TSval=8599958 TSecr=1060329583

Frame 8630: 68 bytes on wire (544 bits), 68 bytes captured (544 bits) on interface 0
Linux cooked capture
Internet Protocol Version 4, Src: 151.80.185.213, Dst: 192.168.1.35
Transmission Control Protocol, Src Port: 4000, Dst Port: 39302, Seq: 1495, Ack: 57, Len: 0

No.     Time           Source                Destination           Protocol Length Info
   8631 25.923002237   192.168.1.35          151.80.185.213        TCP      73     39302 → 4000 [PSH, ACK] Seq=57 Ack=1495 Win=34560 Len=5 TSval=1060329811 TSecr=8599958

Frame 8631: 73 bytes on wire (584 bits), 73 bytes captured (584 bits) on interface 0
Linux cooked capture
Internet Protocol Version 4, Src: 192.168.1.35, Dst: 151.80.185.213
Transmission Control Protocol, Src Port: 39302, Dst Port: 4000, Seq: 57, Ack: 1495, Len: 5
Data (5 bytes)

0000  03 fa 13 34 14                                    ...4.

No.     Time           Source                Destination           Protocol Length Info
   8632 26.156440363   151.80.185.213        192.168.1.35          TCP      68     4000 → 39302 [ACK] Seq=1495 Ack=62 Win=131584 Len=0 TSval=8599981 TSecr=1060329811

Frame 8632: 68 bytes on wire (544 bits), 68 bytes captured (544 bits) on interface 0
Linux cooked capture
Internet Protocol Version 4, Src: 151.80.185.213, Dst: 192.168.1.35
Transmission Control Protocol, Src Port: 4000, Dst Port: 39302, Seq: 1495, Ack: 62, Len: 0

No.     Time           Source                Destination           Protocol Length Info
   8633 26.156464374   192.168.1.35          151.80.185.213        TCP      78     39302 → 4000 [PSH, ACK] Seq=62 Ack=1495 Win=34560 Len=10 TSval=1060330045 TSecr=8599981

Frame 8633: 78 bytes on wire (624 bits), 78 bytes captured (624 bits) on interface 0
Linux cooked capture
Internet Protocol Version 4, Src: 192.168.1.35, Dst: 151.80.185.213
Transmission Control Protocol, Src Port: 39302, Dst Port: 4000, Seq: 62, Ack: 1495, Len: 10
Data (10 bytes)

0000  03 ff 13 2d 14 03 00 14 2d 14                     ...-....-.

No.     Time           Source                Destination           Protocol Length Info
   8634 26.302972828   151.80.185.213        192.168.1.35          TCP      76     4000 → 39302 [PSH, ACK] Seq=1495 Ack=72 Win=131584 Len=8 TSval=8599996 TSecr=1060330045

Frame 8634: 76 bytes on wire (608 bits), 76 bytes captured (608 bits) on interface 0
Linux cooked capture
Internet Protocol Version 4, Src: 151.80.185.213, Dst: 192.168.1.35
Transmission Control Protocol, Src Port: 4000, Dst Port: 39302, Seq: 1495, Ack: 72, Len: 8
Data (8 bytes)

0000  08 58 83 86 36 49 6d 2d                           .X..6Im-

No.     Time           Source                Destination           Protocol Length Info
   8635 26.302996959   192.168.1.35          151.80.185.213        TCP      77     39302 → 4000 [PSH, ACK] Seq=72 Ack=1503 Win=34560 Len=9 TSval=1060330191 TSecr=8599996

Frame 8635: 77 bytes on wire (616 bits), 77 bytes captured (616 bits) on interface 0
Linux cooked capture
Internet Protocol Version 4, Src: 192.168.1.35, Dst: 151.80.185.213
Transmission Control Protocol, Src Port: 39302, Dst Port: 4000, Seq: 72, Ack: 1503, Len: 9
Data (9 bytes)

0000  13 00 00 00 00 02 00 00 00                        .........

No.     Time           Source                Destination           Protocol Length Info
   8636 26.379380455   151.80.185.213        192.168.1.35          TCP      483    4000 → 39302 [PSH, ACK] Seq=1503 Ack=81 Win=131584 Len=415 TSval=8600003 TSecr=1060330191

Frame 8636: 483 bytes on wire (3864 bits), 483 bytes captured (3864 bits) on interface 0
Linux cooked capture
Internet Protocol Version 4, Src: 151.80.185.213, Dst: 192.168.1.35
Transmission Control Protocol, Src Port: 4000, Dst Port: 39302, Seq: 1503, Ack: 81, Len: 415
Data (415 bytes)

0000  f1 9f 01 d7 eb f1 f1 d7 e9 2b f0 2c 84 49 b3 ef   .........+.,.I..
0010  cd 6b 63 28 76 b9 4c dd 0a 21 e4 2d 0f 06 60 1c   .kc(v.L..!.-..`.
0020  63 18 f2 4a d1 59 6a a5 a0 28 03 2e d0 3e 14 08   c..J.Yj..(...>..
0030  50 72 5a 2c 90 c1 ac 7d 12 1b 70 2c 84 96 68 d7   PrZ,...}..p,..h.
0040  bf 35 ad 8c a2 9a 03 40 90 56 44 3c 85 a6 00 54   .5.....@.VD<...T
0050  a6 98 80 0e c8 01 18 80 1b 48 82 50 38 08 63 e0   .........H.P8.c.
0060  1a 36 15 47 70 c4 74 05 90 88 8e 9f df 9a a3 5b   .6.Gp.t........[
0070  19 4b 48 56 8b 86 c8 40 80 5a 0e 12 8f 64 21 00   .KHV...@.Z...d!.
0080  68 68 45 00 c2 b8 b4 53 03 84 00 bc 28 84 71 e4   hhE....S....(.q.
0090  3f 01 a1 6c 00 86 b3 e0 59 92 39 a1 b7 40 9f 9c   ?..l....Y.9..@..
00a0  48 08 ca 71 3b 0f 43 a3 eb 81 64 24 d6 0e 7d f9   H..q;.C...d$..}.
00b0  ac 84 8c a0 19 19 14 1e 1b 21 1e 42 d0 35 35 24   .........!.B.55$
00c0  12 17 08 48 42 11 d9 4c 4a 19 00 89 0a a8 03 9e   ...HB..LJ.......
00d0  18 87 44 a2 f0 b6 22 2b 2d 0f 89 01 e0 f2 48 2d   ..D..."+-.....H-
00e0  06 b3 e0 59 09 2d 12 8f 7e 6a 8d 6a 31 94 0d a4   ...Y.-..~j.j1...
00f0  5a 12 41 ca 12 04 2d 1a 91 85 28 60 0e 0d 08 23   Z.A...-...(`...#
0100  c0 76 2d 08 20 70 ae 2f 02 70 8c 58 07 80 30 2d   .v-. p./.p.X..0-
0110  8a 00 59 92 39 a1 d7 40 a3 9c 48 04 63 29 c4 ec   ..Y.9..@..H.c)..
0120  3d 0e 8f ae 05 99 23 9a 1d f4 0a 39 c4 80 46 32   =.....#....9..F2
0130  9c 2e 76 1e 87 47 d7 02 c8 43 83 43 7f 7e 6b 5b   ..v..G...C.C.~k[
0140  19 41 b9 91 d9 7c 2b 21 5c ed 3d 6a 01 60 28 8e   .A...|+!\.=j.`(.
0150  e0 59 08 78 68 71 ef cd 6b 63 28 54 23 1d 97 c2   .Y.xhq..kc(T#...
0160  b2 11 e4 2d 1c 89 a3 f9 2c 1b 80 a0 6a 0f 23 e1   ...-....,...j.#.
0170  0e 3b 81 64 24 b3 42 3f bf 35 ad 8c a8 0d 4a 60   .;.d$.B?.5....J`
0180  e8 48 42 3c 85 a3 c3 71 5c 63 18 e2 88 b2 3f 07   .HB<...q\c....?.
0190  a9 42 c8 01 10 43 e1 fd 29 b0 84 20 86 94 40      .B...C..).. ..@

No.     Time           Source                Destination           Protocol Length Info
   8637 26.379405003   151.80.185.213        192.168.1.35          TCP      283    4000 → 39302 [PSH, ACK] Seq=1918 Ack=81 Win=131584 Len=215 TSval=8600003 TSecr=1060330191

Frame 8637: 283 bytes on wire (2264 bits), 283 bytes captured (2264 bits) on interface 0
Linux cooked capture
Internet Protocol Version 4, Src: 151.80.185.213, Dst: 192.168.1.35
Transmission Control Protocol, Src Port: 4000, Dst Port: 39302, Seq: 1918, Ack: 81, Len: 215
Data (215 bytes)

0000  d7 02 c8 44 e3 42 47 bf 35 ad 8c a1 db 2b 45 50   ...D.BG.5....+EP
0010  f5 08 f2 16 9c cc 4c 2e 2d 72 70 ca b5 20 f2 08   ......L.-rp.. ..
0020  12 0f a0 1c 1f 80 74 44 f0 f0 7b 01 2c 9f 68 55   ......tD..{.,.hU
0030  25 88 45 20 62 00 4c c0 f8 3f 1d c0 b2 12 61 a0   %.E b.L..?....a.
0040  6d ef cd 6b 63 28 a6 9c 9c 38 03 94 23 c8 5a 01   m..kc(...8..#.Z.
0050  e8 4d 8b 80 2a e0 d8 04 00 c3 36 96 9a 8c 67 69   .M..*.....6...gi
0060  41 e8 01 14 89 ad b8 16 42 76 88 37 f7 e6 a8 d6   A.......Bv.7....
0070  c6 50 0c 47 5a 24 80 94 2b 90 04 52 30 e8 3a 0c   .P.GZ$..+..R0.:.
0080  07 42 ae ff c5 6d ff 88 37 e3 04 0f df b4 2a 06   .B...m..7.....*.
0090  c0 32 17 42 a2 d0 92 98 62 37 0d 67 c0 fd fb 22   .2.B....b7.g..."
00a0  a8 ae ac 80 0b 07 c1 30 9c 0c c4 30 d2 88 0f df   .......0...0....
00b0  b2 2b 0b 01 54 84 56 88 13 0a 00 cc 6f 0d 28 94   .+..T.V.....o.(.
00c0  af de d0 00 69 e8 85 9b 05 d0 96 7c 44 14 4b eb   ....i......|D.K.
00d0  47 71 48 04 0f 20 d2                              GqH.. .

No.     Time           Source                Destination           Protocol Length Info
   8638 26.379440952   192.168.1.35          151.80.185.213        TCP      68     39302 → 4000 [ACK] Seq=81 Ack=2133 Win=36736 Len=0 TSval=1060330268 TSecr=8600003

Frame 8638: 68 bytes on wire (544 bits), 68 bytes captured (544 bits) on interface 0
Linux cooked capture
Internet Protocol Version 4, Src: 192.168.1.35, Dst: 151.80.185.213
Transmission Control Protocol, Src Port: 39302, Dst Port: 4000, Seq: 81, Ack: 2133, Len: 0

No.     Time           Source                Destination           Protocol Length Info
   8642 26.581236968   151.80.185.213        192.168.1.35          TCP      76     4000 → 39302 [PSH, ACK] Seq=2133 Ack=81 Win=131584 Len=8 TSval=8600024 TSecr=1060330268

Frame 8642: 76 bytes on wire (608 bits), 76 bytes captured (608 bits) on interface 0
Linux cooked capture
Internet Protocol Version 4, Src: 151.80.185.213, Dst: 192.168.1.35
Transmission Control Protocol, Src Port: 4000, Dst Port: 39302, Seq: 2133, Ack: 81, Len: 8
Data (8 bytes)

0000  08 58 7f a2 68 53 69 68                           .X..hSih

No.     Time           Source                Destination           Protocol Length Info
   8643 26.624664432   192.168.1.35          151.80.185.213        TCP      68     39302 → 4000 [ACK] Seq=81 Ack=2141 Win=36736 Len=0 TSval=1060330469 TSecr=8600024

Frame 8643: 68 bytes on wire (544 bits), 68 bytes captured (544 bits) on interface 0
Linux cooked capture
Internet Protocol Version 4, Src: 192.168.1.35, Dst: 151.80.185.213
Transmission Control Protocol, Src Port: 39302, Dst Port: 4000, Seq: 81, Ack: 2141, Len: 0

No.     Time           Source                Destination           Protocol Length Info
   8645 26.749991252   151.80.185.213        192.168.1.35          TCP      103    4000 → 39302 [PSH, ACK] Seq=2141 Ack=81 Win=131584 Len=35 TSval=8600040 TSecr=1060330469

Frame 8645: 103 bytes on wire (824 bits), 103 bytes captured (824 bits) on interface 0
Linux cooked capture
Internet Protocol Version 4, Src: 151.80.185.213, Dst: 192.168.1.35
Transmission Control Protocol, Src Port: 4000, Dst Port: 39302, Seq: 2141, Ack: 81, Len: 35
Data (35 bytes)

0000  23 44 8d 05 00 b2 89 1a 04 68 05 94 48 d0 1a 20   #D.......h..H.. 
0010  16 51 91 47 e8 05 94 64 51 f4 68 05 94 64 51 f3   .Q.G...dQ.h..dQ.
0020  44 02 c8                                          D..

No.     Time           Source                Destination           Protocol Length Info
   8646 26.750017926   192.168.1.35          151.80.185.213        TCP      68     39302 → 4000 [ACK] Seq=81 Ack=2176 Win=36736 Len=0 TSval=1060330638 TSecr=8600040

Frame 8646: 68 bytes on wire (544 bits), 68 bytes captured (544 bits) on interface 0
Linux cooked capture
Internet Protocol Version 4, Src: 192.168.1.35, Dst: 151.80.185.213
Transmission Control Protocol, Src Port: 39302, Dst Port: 4000, Seq: 81, Ack: 2176, Len: 0

No.     Time           Source                Destination           Protocol Length Info
   8647 26.824247160   151.80.185.213        192.168.1.35          TCP      78     4000 → 39302 [PSH, ACK] Seq=2176 Ack=81 Win=131584 Len=10 TSval=8600047 TSecr=1060330638

Frame 8647: 78 bytes on wire (624 bits), 78 bytes captured (624 bits) on interface 0
Linux cooked capture
Internet Protocol Version 4, Src: 151.80.185.213, Dst: 192.168.1.35
Transmission Control Protocol, Src Port: 4000, Dst Port: 39302, Seq: 2176, Ack: 81, Len: 10
Data (10 bytes)

0000  0a 3c 5d 37 08 d1 39 a0 ed ac                     .<]7..9...

No.     Time           Source                Destination           Protocol Length Info
   8648 26.824270316   192.168.1.35          151.80.185.213        TCP      68     39302 → 4000 [ACK] Seq=81 Ack=2186 Win=36736 Len=0 TSval=1060330713 TSecr=8600047

Frame 8648: 68 bytes on wire (544 bits), 68 bytes captured (544 bits) on interface 0
Linux cooked capture
Internet Protocol Version 4, Src: 192.168.1.35, Dst: 151.80.185.213
Transmission Control Protocol, Src Port: 39302, Dst Port: 4000, Seq: 81, Ack: 2186, Len: 0

No.     Time           Source                Destination           Protocol Length Info
   8649 26.923439430   192.168.1.35          151.80.185.213        TCP      73     39302 → 4000 [PSH, ACK] Seq=81 Ack=2186 Win=36736 Len=5 TSval=1060330812 TSecr=8600047

Frame 8649: 73 bytes on wire (584 bits), 73 bytes captured (584 bits) on interface 0
Linux cooked capture
Internet Protocol Version 4, Src: 192.168.1.35, Dst: 151.80.185.213
Transmission Control Protocol, Src Port: 39302, Dst Port: 4000, Seq: 81, Ack: 2186, Len: 5
Data (5 bytes)

0000  03 08 14 29 14                                    ...).

No.     Time           Source                Destination           Protocol Length Info
   8650 27.141467969   151.80.185.213        192.168.1.35          TCP      68     4000 → 39302 [ACK] Seq=2186 Ack=86 Win=131584 Len=0 TSval=8600080 TSecr=1060330812

Frame 8650: 68 bytes on wire (544 bits), 68 bytes captured (544 bits) on interface 0
Linux cooked capture
Internet Protocol Version 4, Src: 151.80.185.213, Dst: 192.168.1.35
Transmission Control Protocol, Src Port: 4000, Dst Port: 39302, Seq: 2186, Ack: 86, Len: 0

No.     Time           Source                Destination           Protocol Length Info
   8651 27.163375649   192.168.1.35          151.80.185.213        TCP      73     39302 → 4000 [PSH, ACK] Seq=86 Ack=2186 Win=36736 Len=5 TSval=1060331052 TSecr=8600080

Frame 8651: 73 bytes on wire (584 bits), 73 bytes captured (584 bits) on interface 0
Linux cooked capture
Internet Protocol Version 4, Src: 192.168.1.35, Dst: 151.80.185.213
Transmission Control Protocol, Src Port: 39302, Dst Port: 4000, Seq: 86, Ack: 2186, Len: 5
Data (5 bytes)

0000  03 0b 14 24 14                                    ...$.

No.     Time           Source                Destination           Protocol Length Info
   8652 27.391505202   151.80.185.213        192.168.1.35          TCP      68     4000 → 39302 [ACK] Seq=2186 Ack=91 Win=131584 Len=0 TSval=8600105 TSecr=1060331052

Frame 8652: 68 bytes on wire (544 bits), 68 bytes captured (544 bits) on interface 0
Linux cooked capture
Internet Protocol Version 4, Src: 151.80.185.213, Dst: 192.168.1.35
Transmission Control Protocol, Src Port: 4000, Dst Port: 39302, Seq: 2186, Ack: 91, Len: 0

No.     Time           Source                Destination           Protocol Length Info
   8653 27.438937601   192.168.1.35          151.80.185.213        TCP      73     39302 → 4000 [PSH, ACK] Seq=91 Ack=2186 Win=36736 Len=5 TSval=1060331327 TSecr=8600105

Frame 8653: 73 bytes on wire (584 bits), 73 bytes captured (584 bits) on interface 0
Linux cooked capture
Internet Protocol Version 4, Src: 192.168.1.35, Dst: 151.80.185.213
Transmission Control Protocol, Src Port: 39302, Dst Port: 4000, Seq: 91, Ack: 2186, Len: 5
Data (5 bytes)

0000  03 0b 14 23 14                                    ...#.

No.     Time           Source                Destination           Protocol Length Info
   8654 27.580755394   151.80.185.213        192.168.1.35          TCP      116    4000 → 39302 [PSH, ACK] Seq=2186 Ack=96 Win=131584 Len=48 TSval=8600124 TSecr=1060331327

Frame 8654: 116 bytes on wire (928 bits), 116 bytes captured (928 bits) on interface 0
Linux cooked capture
Internet Protocol Version 4, Src: 151.80.185.213, Dst: 192.168.1.35
Transmission Control Protocol, Src Port: 4000, Dst Port: 39302, Seq: 2186, Ack: 96, Len: 48
Data (48 bytes)

0000  30 1f 1d 7e a5 7e eb b4 21 34 f4 42 cd 84 44 59   0..~.~..!4.B..DY
0010  f2 2c f8 b2 8a 80 8b 3e 2c a2 46 80 8b 3e 2c a3   .,.....>,.F..>,.
0020  22 cf 9a 20 16 51 d0 1a 20 16 51 a3 40 68 80 59   ".. .Q.. .Q.@h.Y

No.     Time           Source                Destination           Protocol Length Info
   8655 27.580783073   192.168.1.35          151.80.185.213        TCP      68     39302 → 4000 [ACK] Seq=96 Ack=2234 Win=36736 Len=0 TSval=1060331469 TSecr=8600124

Frame 8655: 68 bytes on wire (544 bits), 68 bytes captured (544 bits) on interface 0
Linux cooked capture
Internet Protocol Version 4, Src: 192.168.1.35, Dst: 151.80.185.213
Transmission Control Protocol, Src Port: 39302, Dst Port: 4000, Seq: 96, Ack: 2234, Len: 0

No.     Time           Source                Destination           Protocol Length Info
   8657 27.659848506   151.80.185.213        192.168.1.35          TCP      199    4000 → 39302 [PSH, ACK] Seq=2234 Ack=96 Win=131584 Len=131 TSval=8600132 TSecr=1060331469

Frame 8657: 199 bytes on wire (1592 bits), 199 bytes captured (1592 bits) on interface 0
Linux cooked capture
Internet Protocol Version 4, Src: 151.80.185.213, Dst: 192.168.1.35
Transmission Control Protocol, Src Port: 4000, Dst Port: 39302, Seq: 2234, Ack: 96, Len: 131
Data (131 bytes)

0000  83 04 68 7b 70 d6 c8 4f 65 69 19 c1 0b a1 e6 4a   ..h{p..Oei.....J
0010  c5 d0 cc d9 d2 c4 3c 35 b2 13 d9 5a 78 b9 1f 8c   ......<5...Zx...
0020  6e 1a 59 09 4c e7 8b 9c 71 ad c3 2b 21 61 9c f1   n.Y.L...q..+!a..
0030  73 7e 1a 21 a1 90 94 ce 46 5c df 9f f8 23 63 87   s~.!....F\...#c.
0040  8e 48 68 2c b2 b4 d4 98 40 e0 85 d8 e6 4a c5 d0   .Hh,....@....J..
0050  cc d9 d2 c6 39 21 a0 b2 ca d3 c5 cd b8 dd 65 a0   ....9!........e.
0060  c6 ca f2 32 e6 dc fd 7e 78 ba 7e 35 b9 f6 82 73   ...2...~x.~5...s
0070  39 e2 ed 71 ad da 68 27 b3 9e 2e cf 1a dc 3d 68   9..q..h'......=h
0080  2a 33 80                                          *3.

No.     Time           Source                Destination           Protocol Length Info
   8658 27.659871045   192.168.1.35          151.80.185.213        TCP      68     39302 → 4000 [ACK] Seq=96 Ack=2365 Win=37888 Len=0 TSval=1060331548 TSecr=8600132

Frame 8658: 68 bytes on wire (544 bits), 68 bytes captured (544 bits) on interface 0
Linux cooked capture
Internet Protocol Version 4, Src: 192.168.1.35, Dst: 151.80.185.213
Transmission Control Protocol, Src Port: 39302, Dst Port: 4000, Seq: 96, Ack: 2365, Len: 0

No.     Time           Source                Destination           Protocol Length Info
   8662 28.533981605   151.80.185.213        192.168.1.35          TCP      79     4000 → 39302 [PSH, ACK] Seq=2365 Ack=96 Win=131584 Len=11 TSval=8600219 TSecr=1060331548

Frame 8662: 79 bytes on wire (632 bits), 79 bytes captured (632 bits) on interface 0
Linux cooked capture
Internet Protocol Version 4, Src: 151.80.185.213, Dst: 192.168.1.35
Transmission Control Protocol, Src Port: 4000, Dst Port: 39302, Seq: 2365, Ack: 96, Len: 11
Data (11 bytes)

0000  0b 52 c7 74 ad 05 66 5e 88 59 b0                  .R.t..f^.Y.

No.     Time           Source                Destination           Protocol Length Info
   8663 28.534009140   192.168.1.35          151.80.185.213        TCP      68     39302 → 4000 [ACK] Seq=96 Ack=2376 Win=37888 Len=0 TSval=1060332422 TSecr=8600219

Frame 8663: 68 bytes on wire (544 bits), 68 bytes captured (544 bits) on interface 0
Linux cooked capture
Internet Protocol Version 4, Src: 192.168.1.35, Dst: 151.80.185.213
Transmission Control Protocol, Src Port: 39302, Dst Port: 4000, Seq: 96, Ack: 2376, Len: 0

No.     Time           Source                Destination           Protocol Length Info
   8665 28.734987974   192.168.1.35          151.80.185.213        TCP      81     39302 → 4000 [PSH, ACK] Seq=96 Ack=2376 Win=37888 Len=13 TSval=1060332623 TSecr=8600219

Frame 8665: 81 bytes on wire (648 bits), 81 bytes captured (648 bits) on interface 0
Linux cooked capture
Internet Protocol Version 4, Src: 192.168.1.35, Dst: 151.80.185.213
Transmission Control Protocol, Src Port: 39302, Dst Port: 4000, Seq: 96, Ack: 2376, Len: 13
Data (13 bytes)

0000  6d 2c 3a 03 00 2f 00 00 00 00 00 00 00            m,:../.......

No.     Time           Source                Destination           Protocol Length Info
   8671 28.816024157   151.80.185.213        192.168.1.35          TCP      97     4000 → 39302 [PSH, ACK] Seq=2376 Ack=109 Win=131584 Len=29 TSval=8600247 TSecr=1060332623

Frame 8671: 97 bytes on wire (776 bits), 97 bytes captured (776 bits) on interface 0
Linux cooked capture
Internet Protocol Version 4, Src: 151.80.185.213, Dst: 192.168.1.35
Transmission Control Protocol, Src Port: 4000, Dst Port: 39302, Seq: 2376, Ack: 109, Len: 29
Data (29 bytes)

0000  1d 1f 7f ff ff ff c7 c7 5f a9 43 dd 1b 41 4d 97   ........_.C..AM.
0010  a2 16 6c 29 5f ba 06 84 06 9e 88 59 b0            ..l)_......Y.

No.     Time           Source                Destination           Protocol Length Info
   8672 28.816048918   192.168.1.35          151.80.185.213        TCP      68     39302 → 4000 [ACK] Seq=109 Ack=2405 Win=37888 Len=0 TSval=1060332704 TSecr=8600247

Frame 8672: 68 bytes on wire (544 bits), 68 bytes captured (544 bits) on interface 0
